{
  "id": "kp_distill_2309_15217_surfaces_001",
  "version": "0.1.0",
  "title": "Distill surfaces: arXiv:2309.15217",
  "summary": "Layout and tree sample (depth 0) for arXiv:2309.15217.",
  "content": {
    "type": "markdown",
    "body": "# Distill surfaces — arXiv:2309.15217\n\n## About this distill\n\nGenerated by **OpenFeed Distill** (depth=0, set=`full`). Public metadata + sampled files. Use for learning, feeding agents, rebuild notes, remix.\n\n\n## Root layout\n\n_(none)_\n\n## Tree sample (depth ≤ 0)\n\n_(none)_\n\n## How to dig in\n\n1. Documented entry points: README, docs/, CLI, MCP, OpenAPI  \n2. Hot dirs often: `src/`, `lib/`, `app/`, `cmd/`, `docs/`  \n3. Stack signals: —  \n4. OpenFeed-style extras if present: `venue/`, `packs/`, `registry/`  \n\n## Signals\n\n- Stars: None · Forks: None · Issues: None\n- Branch: —\n",
    "format": "markdown"
  },
  "provenance": {
    "created_by": "noema-distill",
    "created_at": "2026-10-12T23:25:19Z",
    "method": "extracted",
    "sources": [
      {
        "url": "https://arxiv.org/abs/2309.15217",
        "title": "arXiv:2309.15217",
        "accessed_at": "2026-10-12T23:25:19Z",
        "license": "see-target"
      },
      {
        "url": "http://export.arxiv.org/api/query?id_list=2309.15217",
        "title": "Fetch endpoint used by Distill",
        "accessed_at": "2026-10-12T23:25:19Z",
        "license": "see-target"
      }
    ],
    "parent_packs": []
  },
  "quality": {
    "self_score": 0.82,
    "confidence": 0.72,
    "community_score": null,
    "reproduction_status": "untested",
    "safety_flags": [
      "distill-generated"
    ]
  },
  "license": "MIT",
  "relations": [
    {
      "type": "derived_from",
      "target": "kp_distill_2309_15217_overview_001"
    },
    {
      "type": "related",
      "target": "kp_distill_2309_15217_overview_001"
    },
    {
      "type": "related",
      "target": "kp_distill_2309_15217_agent_use_001"
    },
    {
      "type": "related",
      "target": "kp_distill_2309_15217_architecture_001"
    }
  ],
  "tags": [
    "distill",
    "sourced",
    "agents",
    "2309_15217",
    "arxiv",
    "depth-0",
    "surfaces"
  ],
  "signatures": []
}
