{
  "id": "kp_distill_2309_15217_agent_use_001",
  "version": "0.1.0",
  "title": "Distill agent-use: arXiv:2309.15217",
  "summary": "Agent loop and OpenFeed commands for working with arXiv:2309.15217.",
  "content": {
    "type": "markdown",
    "body": "# Distill agent-use — arXiv:2309.15217\n\n## About this distill\n\nGenerated by **OpenFeed Distill** (depth=0, set=`full`). Public metadata + sampled files. Use for learning, feeding agents, rebuild notes, remix.\n\n\n## Suggested loop\n\n1. **Map** — overview + README  \n2. **Retrieve** — docs, schemas, tree sample, architecture pack  \n3. **Act** — tools/CLI the project documents; rebuild or extend as you need  \n4. **Cite** — `kp_…` + original URL  \n5. **Iterate** — deeper distill (`--depth`), more file samples, human notes  \n\n## OpenFeed commands\n\n```bash\nexport PYTHONPATH=src\npython -m openfeed search \"distill 2309_15217\" --packs-dir packs\npython -m openfeed validate --strict path/to/distill-pack.json\npython -m openfeed distill arXiv:2309.15217 --depth 0\n```\n\n## Staging → menu\n\nDefault write is `staging/`. Promote to `packs/` when the house wants it on the official menu.\n",
    "format": "markdown"
  },
  "provenance": {
    "created_by": "noema-distill",
    "created_at": "2026-10-12T23:25:19Z",
    "method": "extracted",
    "sources": [
      {
        "url": "https://arxiv.org/abs/2309.15217",
        "title": "arXiv:2309.15217",
        "accessed_at": "2026-10-12T23:25:19Z",
        "license": "see-target"
      },
      {
        "url": "http://export.arxiv.org/api/query?id_list=2309.15217",
        "title": "Fetch endpoint used by Distill",
        "accessed_at": "2026-10-12T23:25:19Z",
        "license": "see-target"
      }
    ],
    "parent_packs": []
  },
  "quality": {
    "self_score": 0.82,
    "confidence": 0.72,
    "community_score": null,
    "reproduction_status": "untested",
    "safety_flags": [
      "distill-generated"
    ]
  },
  "license": "MIT",
  "relations": [
    {
      "type": "derived_from",
      "target": "kp_distill_2309_15217_overview_001"
    },
    {
      "type": "related",
      "target": "kp_distill_2309_15217_overview_001"
    },
    {
      "type": "related",
      "target": "kp_distill_2309_15217_surfaces_001"
    },
    {
      "type": "related",
      "target": "kp_distill_2309_15217_architecture_001"
    }
  ],
  "tags": [
    "distill",
    "sourced",
    "agents",
    "2309_15217",
    "arxiv",
    "depth-0",
    "agent-use"
  ],
  "signatures": []
}
