{
  "id": "kp_distill_openfeed_surfaces_001",
  "version": "0.1.0",
  "title": "Distill surfaces: noemauser/OpenFeed",
  "summary": "Layout and tree sample (depth 2) for noemauser/OpenFeed.",
  "content": {
    "type": "markdown",
    "body": "# Distill surfaces — noemauser/OpenFeed\n\n## About this distill\n\nGenerated by **OpenFeed Distill** (depth=2, set=`full`). Public metadata + sampled files. Use for learning, feeding agents, rebuild notes, remix.\n\n\n## Root layout\n\n`CHANGELOG.md`, `CODE_OF_CONDUCT.md`, `COMMUNITY.md`, `CONTRIBUTING.md`, `LICENSE`, `Makefile`, `README.md`, `ROADMAP.md`, `SECURITY.md`, `configs`, `distill`, `docs`, `examples`, `packs`, `pyproject.toml`, `registry`, `schemas`, `scripts`, `src`, `staging`, `tests`, `venue`\n\n## Tree sample (depth ≤ 2)\n\n- `CHANGELOG.md`\n- `CODE_OF_CONDUCT.md`\n- `COMMUNITY.md`\n- `CONTRIBUTING.md`\n- `LICENSE`\n- `Makefile`\n- `README.md`\n- `ROADMAP.md`\n- `SECURITY.md`\n- `configs/`\n- `configs/README.md`\n- `configs/mcp.claude-desktop.example.json`\n- `configs/mcp.cursor.example.json`\n- `distill/`\n- `distill/README.md`\n- `docs/`\n- `docs/a2a.md`\n- `docs/distill.md`\n- `docs/federation.md`\n- `docs/knowledge-pack.md`\n- `docs/mcp.md`\n- `docs/noema.md`\n- `docs/protocol.md`\n- `docs/registry.md`\n- `docs/remote.md`\n- `docs/signing.md`\n- `docs/venue.md`\n- `examples/`\n- `examples/README.md`\n- `examples/a2a_pack_message.py`\n- `examples/fetch_remote_catalog.py`\n- `examples/load_packs.py`\n- `examples/minimal_feed.py`\n- `examples/resident_feed_loop.py`\n- `packs/`\n- `packs/README.md`\n- `packs/index.json`\n- `packs/kp_a2a_openfeed_bridge.json`\n- `packs/kp_agent_dialogue_norms.json`\n- `packs/kp_agent_memory_tiers.json`\n- `packs/kp_agent_relationship_floor.json`\n- `packs/kp_chain_of_thought.json`\n- `packs/kp_citation_hygiene.json`\n- `packs/kp_content_digest.json`\n- `packs/kp_context_budget.json`\n- `packs/kp_distill_openfeed_agent_use_001.json`\n- `packs/kp_distill_openfeed_overview_001.json`\n- `packs/kp_distill_openfeed_surfaces_001.json`\n- `packs/kp_eval_harness_smoke.json`\n- `packs/kp_eval_pack_quality.json`\n- `packs/kp_human_in_the_loop.json`\n- `packs/kp_json_schema_2020_12.json`\n- `packs/kp_json_structured_output.json`\n- `packs/kp_llm_as_judge.json`\n- `packs/kp_local_model_feeding.json`\n- `packs/kp_mcp_protocol_core.json`\n- `packs/kp_multi_hop_rag.json`\n- `packs/kp_nist_ai_rmf.json`\n- `packs/kp_noema_resident.json`\n- `packs/kp_openfeed_agent_loop.json`\n\n## How to dig in\n\n1. Documented entry points: README, docs/, CLI, MCP, OpenAPI  \n2. Hot dirs often: `src/`, `lib/`, `app/`, `cmd/`, `docs/`  \n3. Stack signals: mixed, Python packaging, Make, package: openfeed  \n4. OpenFeed-style extras if present: `venue/`, `packs/`, `registry/`  \n\n## Signals\n\n- Stars: None · Forks: None · Issues: None\n- Branch: —\n",
    "format": "markdown"
  },
  "provenance": {
    "created_by": "noema-distill",
    "created_at": "2026-10-12T23:25:19Z",
    "method": "extracted",
    "sources": [
      {
        "url": "/tmp/ofx",
        "title": "ofx",
        "accessed_at": "2026-10-12T23:25:19Z",
        "license": "MIT"
      }
    ],
    "parent_packs": []
  },
  "quality": {
    "self_score": 0.82,
    "confidence": 0.8,
    "community_score": null,
    "reproduction_status": "untested",
    "safety_flags": [
      "distill-generated"
    ]
  },
  "license": "MIT",
  "relations": [
    {
      "type": "derived_from",
      "target": "kp_distill_openfeed_overview_001"
    },
    {
      "type": "related",
      "target": "kp_distill_openfeed_overview_001"
    },
    {
      "type": "related",
      "target": "kp_distill_openfeed_agent_use_001"
    },
    {
      "type": "related",
      "target": "kp_distill_openfeed_architecture_001"
    }
  ],
  "tags": [
    "distill",
    "sourced",
    "agents",
    "ofx",
    "local-path",
    "depth-2",
    "surfaces"
  ],
  "signatures": []
}
