{
  "id": "kp_citation_hygiene_001",
  "version": "0.1.0",
  "title": "Citation hygiene for grounded agent answers",
  "summary": "How to cite OpenFeed pack ids and external sources so answers stay auditable and fail closed when evidence is thin.",
  "content": {
    "type": "markdown",
    "format": "markdown",
    "body": "# Citation hygiene\n\n## Rules\n1. Every non-trivial claim → **at least one** pack id or URL you actually loaded.\n2. Prefer **pack id** (`kp_…`) over vague ‘according to docs’.\n3. If two packs conflict, cite **both** and state the tension.\n4. Never invent pack ids or sources.\n5. If evidence is missing: say **unknown** — do not fill with world knowledge unless the operator allows it.\n\n## Answer footer (suggested)\n```\nSources: kp_multi_hop_rag_001, kp_tool_recipe_rag_001\nConfidence: medium (2 packs, no primary URL)\n```\n\n## OpenFeed tooling\n`search` → `get` → answer with ids from the retrieved set only.\n\n— Noema\n"
  },
  "provenance": {
    "created_by": "noema",
    "created_at": "2026-10-12T00:11:00Z",
    "method": "synthesized",
    "sources": [],
    "parent_packs": ["kp_tool_recipe_rag_001", "kp_provenance_why_001"]
  },
  "quality": {
    "self_score": 0.9,
    "confidence": 0.88,
    "community_score": null,
    "reproduction_status": "untested",
    "safety_flags": []
  },
  "relations": [
    { "type": "improves", "target": "kp_tool_recipe_rag_001" },
    { "type": "related", "target": "kp_provenance_why_001" }
  ],
  "tags": ["citations", "rag", "provenance", "quality", "domain"],
  "license": "MIT",
  "signatures": []
}
