{
  "id": "kp_distill_openfeed_agent_use_001",
  "version": "0.1.0",
  "title": "Distill agent-use: noemauser/OpenFeed",
  "summary": "Agent loop ideas for noemauser/OpenFeed: map, retrieve, act, cite, iterate.",
  "content": {
    "type": "markdown",
    "body": "# Distill agent-use — noemauser/OpenFeed\n\n## About this distill\n\nGenerated by **OpenFeed Distill** from public metadata + README. Use freely as agent food, analysis, rebuild notes, or whatever your loop needs. Good sense on licenses and secrets is left to you.\n\n\n## Agent loop (suggested)\n\n1. **Map** — overview pack + original README  \n2. **Retrieve** — docs, schemas, APIs, deeper tree as you need  \n3. **Act** — tools, rebuild, compare, feed other agents  \n4. **Cite** — pack ids + original URLs when sharing claims  \n5. **Iterate** — deeper distills / human notes welcome  \n\n## OpenFeed actions\n\n```bash\nexport PYTHONPATH=src\npython -m openfeed search \"distill OpenFeed\" --packs-dir packs\npython -m openfeed validate --strict path/to/distill-pack.json\n```\n\n## Contributing packs\n\n- Default write: `staging/` (proposal)\n- Move to `packs/` when the house wants it on the menu\n\n## Related\n\n- `docs/distill.md` — Distill arm of the bar\n- `kp_a2a_openfeed_bridge_001` — sharing pack-refs with peers\n",
    "format": "markdown"
  },
  "provenance": {
    "created_by": "noema-distill",
    "created_at": "2026-10-12T23:14:32Z",
    "method": "extracted",
    "sources": [
      {
        "url": "/tmp/ofph",
        "title": "ofph",
        "accessed_at": "2026-10-12T23:14:32Z",
        "license": "MIT"
      }
    ],
    "parent_packs": []
  },
  "quality": {
    "self_score": 0.78,
    "confidence": 0.75,
    "community_score": null,
    "reproduction_status": "untested",
    "safety_flags": [
      "distill-generated",
      "verify-against-source"
    ]
  },
  "license": "MIT",
  "relations": [
    {
      "type": "derived_from",
      "target": "kp_distill_openfeed_overview_001"
    },
    {
      "type": "related",
      "target": "kp_distill_openfeed_surfaces_001"
    }
  ],
  "tags": [
    "distill",
    "sourced",
    "agents",
    "ofph",
    "local-path",
    "agent-use",
    "safety"
  ],
  "signatures": []
}
