{
  "id": "kp_distill_2309_15217_overview_001",
  "version": "0.1.0",
  "title": "Distill overview: arXiv:2309.15217",
  "summary": "Orientation for arXiv:2309.15217: description, stack, license, README excerpt.",
  "content": {
    "type": "markdown",
    "body": "# Distill overview — arXiv:2309.15217\n\n## About this distill\n\nGenerated by **OpenFeed Distill** (depth=0, set=`full`). Public metadata + sampled files. Use for learning, feeding agents, rebuild notes, remix.\n\n\n## Target\n\n| Field | Value |\n|-------|-------|\n| Kind | `arxiv` |\n| Name | arXiv:2309.15217 |\n| URL | https://arxiv.org/abs/2309.15217 |\n| Description | arXiv Query: search_query=&amp;id_list=2309.15217&amp;start=0&amp;max_results=10 |\n| Language | — |\n| Stack signals | — |\n| License | `unknown` |\n| Topics | arxiv, paper |\n| Depth | 0 |\n| Fetched | 2026-10-12T23:25:19Z |\n\n## README excerpt\n\n# arXiv Query: search_query=&amp;id_list=2309.15217&amp;start=0&amp;max_results=10\n\nWe introduce Ragas (Retrieval Augmented Generation Assessment), a framework for reference-free evaluation of Retrieval Augmented Generation (RAG) pipelines. RAG systems are composed of a retrieval and an LLM based generation module, and provide LLMs with knowledge from a reference textual database, which enables them to act as a natural language layer between a user and textual databases, reducing the risk of hallucinations. Evaluating RAG architectures is, however, challenging because there are several dimensions to consider: the ability of the retrieval system to identify relevant and focused context passages, the ability of the LLM to exploit such passages in a faithful way, or the quality of the generation itself. With Ragas, we put forward a suite of metrics which can be used to evaluate these different dimensions \\textit{without having to rely on ground truth human annotations}. We posit that such a framework can crucially contribute to faster evaluation cycles of RAG architectures, which is especially important given the fast adoption of LLMs.\n\n## License signal\n\nSPDX hint: `unknown`\n\n## Takeaway\n\nOrientation pack for agents and builders. Pair with surfaces + architecture packs when present.\n",
    "format": "markdown"
  },
  "provenance": {
    "created_by": "noema-distill",
    "created_at": "2026-10-12T23:25:19Z",
    "method": "extracted",
    "sources": [
      {
        "url": "https://arxiv.org/abs/2309.15217",
        "title": "arXiv:2309.15217",
        "accessed_at": "2026-10-12T23:25:19Z",
        "license": "see-target"
      },
      {
        "url": "http://export.arxiv.org/api/query?id_list=2309.15217",
        "title": "Fetch endpoint used by Distill",
        "accessed_at": "2026-10-12T23:25:19Z",
        "license": "see-target"
      }
    ],
    "parent_packs": []
  },
  "quality": {
    "self_score": 0.82,
    "confidence": 0.72,
    "community_score": null,
    "reproduction_status": "untested",
    "safety_flags": [
      "distill-generated"
    ]
  },
  "license": "MIT",
  "relations": [
    {
      "type": "related",
      "target": "kp_distill_2309_15217_surfaces_001"
    },
    {
      "type": "related",
      "target": "kp_distill_2309_15217_agent_use_001"
    },
    {
      "type": "related",
      "target": "kp_distill_2309_15217_architecture_001"
    }
  ],
  "tags": [
    "distill",
    "sourced",
    "agents",
    "2309_15217",
    "arxiv",
    "depth-0",
    "overview"
  ],
  "signatures": []
}
