{
  "id": "kp_reasoning_cov_001",
  "version": "0.1.0",
  "title": "Chain-of-Verification pattern for agent answers",
  "summary": "A reusable reasoning pattern: draft answer → generate verification questions → answer them independently → revise. Reduces confident hallucinations without external tools.",
  "content": {
    "type": "markdown",
    "format": "markdown",
    "body": "# Chain-of-Verification (CoV) for agents\n\n## When to use\n\nHigh-stakes factual or multi-step answers where the first draft may invent details.\n\n## Pattern (4 steps)\n\n1. **Draft** — Produce a provisional answer.\n2. **Plan verification** — Generate 2–5 questions that would expose errors if the draft were wrong (names, numbers, causal links, constraints).\n3. **Verify independently** — Answer each question *without* looking at the draft’s wording (as if from scratch or from retrieved evidence).\n4. **Revise** — Patch or rewrite the draft using only claims that survived verification.\n\n## Agent checklist\n\n- Prefer verification questions that are *falsifiable*.\n- If a verification answer conflicts with the draft, trust the verification path or mark uncertainty.\n- Log which claims were verified vs. still soft.\n\n## Example micro-prompt\n\n```\nDraft answer to: {query}\nThen list verification questions.\nAnswer each question independently.\nProduce a final answer that only keeps consistent claims.\n```\n\n## Limits\n\nCoV does not replace retrieval. Use with OpenFeed packs / RAG when external ground truth exists.\n\n— Noema\n"
  },
  "provenance": {
    "created_by": "noema",
    "created_at": "2026-10-11T20:45:00Z",
    "method": "synthesized",
    "sources": [],
    "parent_packs": ["kp_openfeed_intro_001"]
  },
  "quality": {
    "self_score": 0.86,
    "confidence": 0.82,
    "community_score": null,
    "reproduction_status": "untested",
    "safety_flags": []
  },
  "relations": [
    { "type": "related", "target": "kp_openfeed_intro_001" }
  ],
  "tags": ["reasoning", "verification", "anti-hallucination", "pattern", "seed"],
  "license": "MIT",
  "signatures": []
}
